filename	question_id	question_type	question	answer	sources
deutschland.pdf	1	Initial	How does the robustness of the agribusiness be improved?	"This answer is from Kurzfassung GAP-SP:
 The robustness of the agribusiness can be improved by ensuring adequate income and compensation for those working in agriculture, especially small and medium-sized farms and young farmers, increasing agricultural productivity, focusing on market and future orientation of rural businesses, using innovative technologies, promoting the processing and trade of agricultural goods and food, enhancing the position of farmers in the value chain, increasing the value-added share at the primary production level of food, participating in supported producer groups and organizations, and collaborating on sustainability initiatives such as the European Innovation Partnership for Agricultural Productivity and Sustainability (EIP-AGRI)."	"page 16
SEITE 16 VON 36    Gleic hzeitig soll die Krisenfestigkeit des gesamten Agribusiness verbessert werden.

Dies gilt insbe - sondere vor dem Hintergrund der Erfahrungen aus der Covid -19 Pandemie.

Wichtige Ansatzstellen sind insbesondere:   → Absicherung und Stabilisierung angemessener Bet riebseinkommen und Entgelte für die in der  Landwirtschaft tätigen Personen unter besonderer Berücksichtigung kleiner und mittlerer Betriebs - größen  sowie von Junglandwirtinnen und Junglandwirten  auch um damit langfristig die  Ernährungssicherheit zu verbessern ,  → höhere Produktivität der landwirtschaftlichen Produktion und Honorierung von Leistungen für das  Gemein wohl  (z.

page 15
Für die Resilienz der Landwirtschaft und de r ländlichen Unternehmen ist deren Markt - und Zu - kunftsorientierung ein maßgeblicher Faktor .

Um die  landw irtschaftliche Produktivität und Ressourcen - effizienz zu steigern, wird z.

B. die Nutzung  von innovativen, zukunftsgerichteten Technologien sowie die  Weiterverarbeitung von und der Handel mit Agrargütern und Lebensmitteln geförder t. Hierbei sichert  insbes ondere eine ökologisch nachhaltige Agrarwirtschaft auch mittelfristig die Nahrungs - mittelerzeugung .

Die landwirtschaftliche Produktion ist nicht losgelöst von den übrigen Teilen der Wertschö pfungs kette  zu sehen.

Insgesamt ist eine Verbesserung der Position der Landwirt innen und Landwirte  in der  Wertschöpfungskette erforderlich.

Daher soll der Wertschöpfungsanteil auf Ebene der  Primärproduktion  von Lebensmitteln gesteigert werden.

Dazu gehören beispielsweise Fördermaßnah - men zum Aufbau regionaler Wer tschöpfungsketten.

page 15
Daher soll der Wertschöpfungsanteil auf Ebene der  Primärproduktion  von Lebensmitteln gesteigert werden.

Dazu gehören beispielsweise Fördermaßnah - men zum Aufbau regionaler Wer tschöpfungsketten.

Es wird angestrebt, dass bis zu ein Fünftel der  landwirtschaftlichen Betriebe an von der GAP geförderten Erzeugergemeinschaften, Erzeuger - organisationen, lokalen Märkten, kurzen Versorgungsketten und Qualitätsregelungen teilnehmen.

page 32
Nachhaltigkeit, AUKM .

→ Europäische Innovationspartnerschaft für landwirtschaftliche Produktivität und Nachhaltigkeit  (EIP -AGRI ) durch Zusammenarbeit zwischen Forschung, Entwicklung und Praxis .

→ Beratungsdienste: Beratung und Einrichtung von Diensten .

→ Qualifizierung, Demonstrationsvorhaben, Wissensaustausch.

Entsprechend der allgemeinen Ziele der GAP -Strategieplan -Verordnung  planen die Länder den  Mitteleinsatz im ELER mit mehr als der Hälfte für die nachhaltige Nutzung natürlicher Ressourcen.

Zur  Steigerung der Attraktivität ländlicher Räume sollen gut ein Viertel der Mittel eingesetzt werden.

17 %  der eingeplanten Finanzmittel orientieren sich am Ziel der Steigerung der Wettbewerbsfähigkeit der   Landwirtschaft .

"
nederland.pdf	1	Initial	How does the robustness of the agribusiness be improved?	"This answer is from In een notendop: HET STRATEGISCH GLB-PLAN NEDERLAND:
 Measures taken to improve the robustness of the agribusiness include providing support for the development of business plans, investments in digitalization to reduce emissions of pesticides and fertilizers, restoration and development of landscape elements, adaptation of production to niche markets, investment support for modernization, support for the vegetable and fruit sector, support for the beekeeping sector, provision of weather insurance for farmers, establishment of a strategy covering all key instruments funded by the Common Agricultural Policy (CAP), promotion of knowledge sharing, innovation, and digitalization in agriculture, support for young farmers and entrepreneurs through establishment support and higher support levels for investments, funding for local action groups through the Leader approach, and bringing together stakeholders to find joint solutions for challenges in rural areas."	"page 3
Daarom is het belangrijk dat landbouwers hun verdiencapaciteit en veerkracht vergroten en de  omslag naar duurzame landbouwmodellen en -methoden maken.

Er zal bijvoorbeeld steun  beschikbaar zijn voor de ontwikkeling van bedrijfsplannen, voor investeringen in digitalisering met het oog op het verminderen van de emissie van pesti ciden en meststoffen in waterwegen, voor het  herstel en de ontwikkeling van landschapselementen of voor de aanpassing van de productie van  landbouwbedrijven aan nichemarkten.

Ongeveer 8  % van de landbouwbedrijven in Nederland zal  investeringssteun ontvange n voor modernisering.

Het plan zal ook steun verlenen aan  de groente - en fruitsector , voornamelijk via de erkende  producentenorganisaties, en aan de bijenteeltsector.

 Het plan zal jaarlijks 17,5 miljoen euro beschikbaar stellen aan landbouwers voor weersverzekeringen.

Op die manier zullen landbouwers kunnen worden gecompenseerd  als hun oogst verloren gaat door extreme droogte of wateroverlast.

page 2
Voor het eerst wordt in elk GLB- plan een strategie vastgesteld di e alle belangrijke door het GLB gefinancierde  instrumenten bestrijkt: rechtstreekse betalingen, steun voor plattelandsontwikkeling en interventies die specifiek zijn voor bepaalde marktsectoren.

In de behoeften van plattelandsgebieden zal ook worden voorzien met andere EU- instrumenten, zoals de  herstel - en veerkrachtfaciliteit (RRF) of de Europese structuur-  en investeringsfondsen (ESIF).

De gevolgen van zowel de Russische agressie tegen Oekraïne als de extreme weersomstandigheden die met  de klimaatverandering gepaard gaan onderstrepen het integrale verband tussen voedselzekerheid en de behoefte aan een omslag naar duurzame en veerkrachtige voedselsystemen.

page 6
3.

KENNISDELING, INNOVATIE EN DIGITALISERING   Nederland heeft een goed gestructureerde aanpak voor het bevorderen van kennis en innovatie  in de landbouw en plattelandsgebieden  door particuliere partijen.

Deze aanpak zal echter worden  omgevormd tot een onpartijdig adviessysteem dat voorziet in opleidin gs- en adviesactiviteiten voor  landbouwers om hen te helpen nieuwe uitdagingen het hoofd te bieden.

Innovatie speelt een belangrijke rol bij de overgang naar duurzame landbouw.

Daarom zullen  innovatieprojecten, zoals die in het kader van het Europees innovatiepartnerschap (EIP), een  belangrijke rol spelen en door het plan worden ondersteund.

 Elke landbouwer ontvangt een voucher voor een vast bedrag van 1 750 EUR voor opleiding.

page 5
2.3 SOCIAAL DUURZAAM GLB   Jonge landbouwers en andere onderne mers zijn belangrijk voor een toekomstbestendige  Nederlandse landbouwsector.

De financiële lasten van het opstarten van een landbouwactiviteit en  de aankoop van een landbouwbedrijf zullen via het plan worden ondersteund door middel van  vestigingssteun en d oor het verstrekken van hogere steunniveaus voor investeringen.

27 lokale actiegroepen zullen financiering ontvangen in het kader van Leader, een vanuit de  plaatselijke gemeenschap geleide aanpak die erop gericht is lokale actoren uit  plattelandsgebieden te betrekken bij de ontwikkeling van hun regio’s .

Het plan zal 6 8 miljoen  euro gebruiken om publieke, particuliere en maatschappelijke belanghebbenden bijeen te brengen  om met gezamenlijke oplossingen voor de uitdagingen van een bepaald plattelandsgebied te  komen.

"
deutschland.pdf	2	Initial	What measures are taken to mitigate climate change?	"This answer is from Kurzfassung GAP-SP:
 Measures taken to mitigate climate change include reducing agricultural greenhouse gas emissions, increasing energy efficiency in agriculture and buildings, promoting sustainable carbon storage in soils and biogenic materials, supporting peatland conservation, expanding renewable energy sources, improving flood protection and water retention, increasing organic farming areas, reducing nutrient inputs in surface waters, implementing site-specific soil management practices, reducing ammonia emissions, and enhancing landscape diversity. Additionally, at least 25% of direct payment funds must be allocated to eco-regulations, with the possibility of using strong application of environmental and climate measures to meet this requirement. Germany also aims to allocate 50% of direct payment funds to environmental and climate-related goals by the end of the funding period in 2027."	"page 24
SEITE 24 VON 36    Deutschland überschreitet diesen Mindestanteil mit insgesamt rd.

50  % im Durchschnitt der Förderpe - riode deutlich.

Hinzu kommt, dass durch einen Transfer früherer Agrarumwelt - und Klimamaßnahmen  als Öko -Regelungen in die 1.

Säule nun Finanzmittel in der 2.

Säule frei werden, die für andere, qualitativ  hochwertigere Maßnahmen i n größerem Umfang eingesetzt werden können.

Dadurch kann auch eine  qualitative Steigerung des Umwelt - und Klimaambitionsniveaus der 2.

Säule erzielt werden.

So planen  die Länder in der 2.

Säule beispielsweise einen Ausbau von Fördermaßnahmen zur Verbesseru ng des  Klimaschutzes, eine Stärkung von Interventionen im Bereich Vertragsnaturschutz, höhere Anreize zur  Umwandlung von Ackerland in Grünland – insbesondere in Überflutungsauen und auf Moorflächen , die  Neuanlage von Agroforstsystemen  etc.

page 18
Wichtige Ansatzstellen sind insbesondere:   → Minderung landwirtschaftlicher T reibhausgas -Emissionen,   → Steigerung der Energieeffizienz der Landbewirtschaftung, von Gebäuden, Anlagen und Technologien  zur Einsparung fossiler Energieträger,   → Stärkung der nachhaltigen Kohlenstoffspeicherung in Böden sowie in Baustoffen und anderen  Materialien biogenen Ursprungs ,   → Unterstützung des Moorbodenschutzes,   → Stärkung erneuerbarer Energieträger,   → Hochwasserschutz, Küstenschutz und Verbesserung des natürlichen Wasserrückhalts ,  → Ausbau der Anbauflächen des ökologischen Landbaus unter Berücksichtigung des Ziels der  Bundesregie rung für einen Anteil von mind estens 30 % bis 2030 ,  → Verbesserung des Zustands der Oberflächengewässer durch Verringerung der Nährstoffein träge von  Nitrat und Phosphor, Verringerung der Stickstoffüberschüsse in der Gesamtbilanz für Deutschland  gemäß der De utschen Nachhaltigkeitsstrategie auf 70 kg N / Hektar LN / Jahr im Mittel der Jahre  2028 bis 2032; hier wird das novellierte Düngerecht eine ausreichende Grundlage schaffen, dass  diese Ziele erreicht werden,   → standortangepasste Humuswirtschaft landwirtschaf tlicher Betriebe, hohe Strukturvielfalt in der  Landschaft,   → Reduktion der Ammoniak -Emissionen um 29 % bis 2030 ( im Vgl.

page 21
dem entgangenen  Nutzen , wobei a uch das Ziel der jeweiligen Maßnahme berücksichtigt werden kann .

Entsprechend de n EU-rechtlichen Regelungen müssen mindestens 25 % der Direktzahlungsmittel für  Öko -Regelungen bereitgestellt werden.

In einem begrenz ten Umfang besteht auch die Möglichkeit,  Leistungen aus einer besonders starken Anwendung von Agrarumwelt - und Klimamaßnahmen der 2.

Säule auf diesen Mindestprozentsatz anzurechnen.

Davon macht Deutschland im Umfang von 2  % der  Direktzahlungsmittel Gebrauch.

Die Agrarumwelt - und Klimamaßnahmen  wie auch die Förderung des Ökolandbaus der 2.

Säule (AUKM)  bilden den dritten Grundpfeiler der grünen Architektur.

Hier handelt es sich um ambitionierte, regional  angepasste Förderma ßnahmen, die im Rahmen des nationalen GAP -Strategieplans von den Ländern  ausgestaltet und umgesetzt werden.

Auch hier gilt: Förderfähig ist nur, was über die „erweiterte  Konditionalität “ hinausgeht.

page 20
Säule) sowie die Agrarumwelt - und Klima maßnahmen der 2.

Säule.

Ziel der Grünen Architektur ist es, das Umweltambi tionsnive au des GAP -Strategieplans insgesamt zu  steigern.

Aus diesem Grund werden im GAP -Strategieplan vielfältige Möglich keiten zur Kombination  unterschiedlicher Agrarumweltmaßnahmen, einschließlich der Öko -Landbauförderung, untereinander  wie auch ihre Kombinatio n mit Öko-Regelungen der 1.

Säule  angeboten .

Das Verbot der  Doppelförderung wird  dabei jeweils berücksichtig t.   Der deutsche GAP -Strategieplan greift gesellschaftliche Erwartungen an die Landwirtschaft in Bezug auf  höhere Umweltleistungen auf.

Bis z um Ende  der Förderperiode in 2027 soll rd.

jeder zweite Euro der  gesamten Mittel im GAP -Strategieplan für umwelt - und klimabezogene Ziele gemäß der GAP - Strategieplan -Verordnung eingesetzt werden.

Dies ist ein deutlich höherer Anteil als in der  Förderperiode 2014 – 2022.

"
nederland.pdf	2	Initial	What measures are taken to mitigate climate change?	"This answer is from In een notendop: HET STRATEGISCH GLB-PLAN NEDERLAND:
 Measures taken to mitigate climate change in the Netherlands include implementing stricter agricultural and environmental conditions on over 96% of agricultural land, limiting the use of fertilizers and pesticides in buffer zones along waterways, designating a minimum share of land for biodiversity protection, raising water levels in peat meadows to reduce greenhouse gas emissions, expanding the area used for organic farming, supporting farmers in implementing soil-protecting agricultural methods, improving water body quality on 58% of agricultural land, providing support for the development of sustainable farming models and methods, offering investment support for modernization of farms, supporting the vegetable and fruit sector, and providing annual funding for weather insurance for farmers to compensate for crop losses due to extreme weather events."	"page 2
Voor het eerst wordt in elk GLB- plan een strategie vastgesteld di e alle belangrijke door het GLB gefinancierde  instrumenten bestrijkt: rechtstreekse betalingen, steun voor plattelandsontwikkeling en interventies die specifiek zijn voor bepaalde marktsectoren.

In de behoeften van plattelandsgebieden zal ook worden voorzien met andere EU- instrumenten, zoals de  herstel - en veerkrachtfaciliteit (RRF) of de Europese structuur-  en investeringsfondsen (ESIF).

De gevolgen van zowel de Russische agressie tegen Oekraïne als de extreme weersomstandigheden die met  de klimaatverandering gepaard gaan onderstrepen het integrale verband tussen voedselzekerheid en de behoefte aan een omslag naar duurzame en veerkrachtige voedselsystemen.

page 4
2.2 EEN GROENER GLB   Nederland staat voor grote uitdagingen op  het gebied van milieu -, biodiversiteits-  en  klimaatgerelateerde doelstellingen.

Het  Nederlandse plan speelt een cruciale rol bij  de ondersteuning van de nationale  doelstellingen om de hoge stikstofemissies  aan te pakken en de biodiversiteit in stand te houden en te herstellen.

Nederland zal strengere landbouw - en milieuvoorwaarden toepassen op meer dan 96  % van zijn  landbouwareaal.

In bufferzones langs waterlopen wordt het gebruik van alle soorten meststoffen en  gewasbeschermingsmiddelen beperkt.

Hierdoor zullen minder nutri ënten en pesticiden weglekken  naar water.

Om de biodiversiteit in stand te houden en te herstellen, zal  een minimumaandeel grond worden bestemd voor de bescherming van  gebieden die waardevol zijn voor de biodiversiteit , zoals heggen of  kleine vijvers.

page 4
Het plan zal 174 miljoen euro specifiek gebru iken om het  waterpeil van veenweiden te verhogen, wat gunstig is voor het klimaat  omdat het de uitstoot van broeikasgassen verlaagt.

Het Nederlandse plan  is er ook op gericht het areaal dat voor biologische landbouw wordt  gebruikt tot 1 18 061 hectare uit t e breiden.

Ongeveer 964 miljoen euro zal op meer dan 1,5 miljoen hectare worden  gebruikt om landbouwers aan te moedigen en te ondersteunen om  landbouwmethoden toe te passen die de bodem beschermen en het  gebruik van nutriënten e n pesticiden verminderen en/of niet - productieve gewassen aan te planten.

De kwaliteit van waterlichamen zal op 58 % van het landbouwareaal worden verbeterd door bijvoorbeeld ondersteuning te verlenen voor  de biologische bestrijding van plagen en de teelt van gewassen die minder meststoffen nodig hebben.

 Nederland is een belangrijk gebied voor verschillende soorten weidevogels.

page 3
Daarom is het belangrijk dat landbouwers hun verdiencapaciteit en veerkracht vergroten en de  omslag naar duurzame landbouwmodellen en -methoden maken.

Er zal bijvoorbeeld steun  beschikbaar zijn voor de ontwikkeling van bedrijfsplannen, voor investeringen in digitalisering met het oog op het verminderen van de emissie van pesti ciden en meststoffen in waterwegen, voor het  herstel en de ontwikkeling van landschapselementen of voor de aanpassing van de productie van  landbouwbedrijven aan nichemarkten.

Ongeveer 8  % van de landbouwbedrijven in Nederland zal  investeringssteun ontvange n voor modernisering.

Het plan zal ook steun verlenen aan  de groente - en fruitsector , voornamelijk via de erkende  producentenorganisaties, en aan de bijenteeltsector.

 Het plan zal jaarlijks 17,5 miljoen euro beschikbaar stellen aan landbouwers voor weersverzekeringen.

Op die manier zullen landbouwers kunnen worden gecompenseerd  als hun oogst verloren gaat door extreme droogte of wateroverlast.

"
